{
  "timestamp": "2026-05-23T10:15:00+00:00",
  "instrument": "MES",
  "session": "new_york",
  "price": {
    "last": 5905.25,
    "bid": 5905.0,
    "ask": 5905.5
  },
  "ohlc": {
    "open": 5880.0,
    "high": 5910.0,
    "low": 5875.0,
    "close": 5905.25,
    "timeframe": "5m",
    "bar_start": "2026-05-23T10:10:00+00:00"
  },
  "vwap": {
    "value": 5895.0,
    "price_vs_vwap": "above",
    "reclaimed": true,
    "holding": true
  },
  "orb": {
    "high": 5898.0,
    "low": 5862.0,
    "timeframe_minutes": 15,
    "status": "reclaimed_high"
  },
  "previous_day": {
    "high": 5920.0,
    "low": 5840.0,
    "close": 5875.0,
    "price_vs_pdh": "below",
    "price_vs_pdl": "above"
  },
  "volume": {
    "current_bar": 4200,
    "avg_bar": 3800,
    "relative": 1.1
  },
  "market_condition": "TRENDING",
  "trend": {
    "direction": "UP",
    "strength": "STRONG",
    "ema_fast_above_slow": true
  },
  "notes": "NY open momentum. ORB formed 9:30-9:45. Price pulled back and reclaimed ORB high at 10:10 with VWAP support. MES active instrument."
}